Unnamed: 0,updated,content,rating,version,author,sentiment
0,2025-12-11T19:44:26-07:00,I like the game….but it’s just so frustrating you move so slowly and I just wish that you could just click to where you want to go other than that the game is pretty fun.❤️♥️,3,0.391.0,Anonymous person27931,neutral
1,2025-12-11T19:24:33-07:00,I just love this game so much I just play it all of the the time when I’m bored and when I’m not I really recommend this game you can do so much fun stuff like recently I caught a cobbling my 16th legendary Pokemon it’s so fun try it out!,5,0.391.0,Ur_localguy,positive
2,2025-12-11T17:30:00-07:00,👍🏽,4,0.391.0,RickeyBobby412,positive
3,2025-12-11T16:58:29-07:00,WE NEED MORE RAID TIME ITS SO STUPID THAT THERES A TIME LIMIT FOR RAIDS ADD MORE TIME AND WHY IS THERE A DAILY GOLD LIMIT NOW THATS DUMB,2,0.391.0,Orangeseal779,negative
4,2025-12-11T15:39:46-07:00,"Would you please change your PIDGEY images?

The PIDGEY you are using for your regular standard wild variant is the ✨SHINY✨ variant.  

The normal one had BROWN plumage.  The one you are using has GOLD plumage.  The one you are using is the ✨SHINY✨ PIDGEY.  

Please fix this.",4,0.391.0,jkj2kxx,positive
5,2025-12-11T14:28:51-07:00,"Lately, my game has gotten very buggy. Every couple minutes, the game will kick me out and I end up losing chances to find shinies. The performance is overall very laggy too. The movements are janky, and the ability to zoom in and out with just a tap on the screen is really the most of it. During car rides, I’ll try to tap a pokemon that shows up just for the screen to zoom in or out like crazy and I struggle to get it back to normal for a bit. I’ve lost out on lots of shinies and other pokemon because of this. Please fix this? I love this game but it’s really hampering my enjoyment.",3,0.391.0,I’m having a stroke,neutral
6,2025-12-11T10:29:57-07:00,Just wondering why I was given a special research that needed to be done within a certain time frame. I thought those are good until you complete them but the Tales of transformation linked with transforming a Keldeo and apparently that was only able to be done during the month of November. I don’t see how I am going to be able to get the research done within that being taken out of the game.,3,0.389.2,ZolotheGhost,neutral
7,2025-12-11T06:22:24-07:00,I love the game its so fun and addicting to play but im displeased by the coins system for gyms. My pokemon been at 1 gym for 34 days and i only got 50 coins. It will be cool if i get it over time or even when he returns cause people are constantly fighting for gyms so its harder to obtain the coins. But the coin system for gyms need to be fixed. Other than that the game is very fun and addicting and it combines games with exercise. Great way to keep fit walking around the neighborhood.,3,0.389.2,unknown3056,neutral
8,2025-12-11T04:58:06-07:00,It’s the best!,5,0.389.2,i hate crowd masters,positive
9,2025-12-11T03:50:07-07:00,It’s fun to get exercise while playing a game so this game is perfect (and it includes a lot of mankeys),5,0.389.2,Spahgett,positive
10,2025-12-11T00:37:37-07:00,Make another game mode or something where you don’t have to walk around,1,0.389.2,yeetling 111236384739571,negative
11,2025-12-10T23:11:53-07:00,Someone has stolen my account. I have spent plenty of time and money building but I can’t get help from Niantic. I have receipts from purchases and even know the new trainer name that has been added to my account. I was level 76 and don’t want to start over. I can still access the pokemongo.com store on the website and see the new trainer name it is KXJ7 changed from my trainer name JBUWELL27. I have screenshots of everything I just need help getting into my account.,1,0.389.2,JBuwell27,negative
12,2025-12-10T19:49:07-07:00,My friend and I used to play a lot. But I deleted the app due to undisclosed reasons and when I reinstalled it the game kept me at a no location data even when I did it pre deletion,4,0.389.2,VMainiac,positive
13,2025-12-10T19:12:20-07:00,Terrible game,1,0.389.2,Comandernutcace,negative
14,2025-12-10T19:11:54-07:00,Awesome but one thing the game needs to fix shiny chances both me and my friend started at the same time and we do the exact same thing and she has 5 times more shinys than me I have 28 and she has 143.,4,0.389.2,Shiny chances,positive
15,2025-12-10T17:31:14-07:00,Help me I can't sign in but anyway I played it on a different phone it's good 4/5 (1 missing star cuz the sign in problem yea devs if you see this please respond I need help),4,0.389.2,BeatLover🎤❤,positive
16,2025-12-10T16:42:24-07:00,"It's just a cash grab now, pay-to-win.",1,0.389.2,I now hate Yahoo,negative
17,2025-12-10T16:29:26-07:00,"The game and Pokémon is great, but it keeps kicking me out of my account, and takes a long to log back in 🫡",4,0.389.2,Devontocool,positive
18,2025-12-10T15:44:06-07:00,"Not to be that guy, but every week my character gets reset to a very light pigment, with blonde hair and blue eyes like it’s 1940’s Germany… and I ALWAYS have to set it back to how my character was originally. Idk if it’s a bug or if other players are having a similar issue with their characters settings getting reset. But it’s getting really annoying.",2,0.389.2,Tyga boss,negative
19,2025-12-10T15:37:06-07:00,"I saw a shiny Aloan vulpix and I didn’t have anything so I couldn’t catch it, why is this so hard?! It’s a kids game. I hope you fix",5,0.389.2,Mine and craft lover,positive
20,2025-12-10T14:53:01-07:00,I can’t move a that YouTube person mystic 7 has the weirdest office people ever and guess what I’m mystic 7,1,0.389.2,"The end:$;&?&382@,",negative
21,2025-12-10T13:29:11-07:00,Always loose connection to gps,1,0.389.2,all175949262,negative
22,2025-12-10T13:20:44-07:00,I like to play the pvp but I constantly run into people cheating and they don’t even hide it they use a shield more than twice blocking all charged attacks and not only that when I have the type advantage It will say not very effective and everything they do is super effective I don’t normally do reviews but I do love this game but the pvp needs either a report button or a better anti cheat,3,0.389.2,Goofal,neutral
23,2025-12-10T12:41:58-07:00,"When I have my in game music muted, eventually the in game sound will bug out and stop making sound too. The temporary fix of unmuting and then re-muting the music to get the sound back seems to be working less and less each day. It gets to a point now where my sound will bug out and stop working and I will turn the music on and then turn it back off to fix it and then I have to repeat the process after like a minute or two. This issue has been around for a while and it’s become a real thorn in my side and for many others. I love this game and have very few complaints but where is the team on fixing this?",4,0.389.2,Jellyfish711,positive
24,2025-12-10T11:06:47-07:00,I left a rating complaining about the Pokémon running away and every time I catch one and them breaking out of every type of ball and even with berries. It was fixed. So 5,5,0.389.2,ethenas,positive
25,2025-12-10T09:30:52-07:00,"I shouldn’t need to get damn arm ache whenever I try to spin a gym or pokestop I should be able to battle a max Pokemon without having to press it 50 times cause it can’t start the max battle. Or I will leave 20,000 1 star reviews.",1,0.389.2,Death itself2263,negative
26,2025-12-10T05:25:17-07:00,It is a very good game and lets me connect with my family and friends.,5,0.389.2,Lil Clanka🗿🗿🗿🍠,positive
27,2025-12-10T05:18:26-07:00,I can’t even move and there’s no graphics I don’t recommend this game it’s a waste of time!,1,0.389.2,Jennyrdh,negative
28,2025-12-10T00:10:25-07:00,"It needs to be removed from the App Store and investigated for rigged outcomes and theft!!! 

DO NOT WASTE YOUR TIME OR MONEY!!",1,0.389.2,aj.autumn,negative
29,2025-12-09T19:07:36-07:00,It’s to good  I have nothing bad to say about it,5,0.389.2,xavier mejia,positive
30,2025-12-09T15:05:58-07:00,1 star,1,0.389.2,Quandale dingle turtle,negative
31,2025-12-09T09:43:56-07:00,Only 5 pc when u got a Pokemon defeated 😞 guys don’t be this abusive at least 10 per Pokemon defeated with no limit daily,1,0.389.2,UmarjvillaR,negative
32,2025-12-09T09:29:37-07:00,This game shouldn’t require 20 pokeballs for one catch. This game shouldn’t need you to travel constantly with no real rewards in between. This game is a money pit. They keep erasing my reviews!! I noticed they are dropping from a 4.8 rating down to 4.0 now.   People are tired of the greed!! Been playing this game like ten years. And nothing to show for it!! Just money sank into it. They literally are like here 2-4 poke balls a day. And that usually won’t even catch a single lemon!! But they don’t care. They just keep erasing reviews trying to keep the ratings up!! But we see you all trying to hide the fact this is a money pit!!,1,0.389.2,Pinto Barbie,negative
33,2025-12-09T09:24:32-07:00,"I woke up to find my many XP reward points disappeared. My collected stamps from pokestops have also vanished. I’m so angry, I want to delete the app",1,0.389.2,Equax,negative
34,2025-12-09T09:06:50-07:00,"My shiny rate is so bad. I do a lot of events, buy ticket, buy coins, i'm a player not KOLs that paying money to the game and get money from the contents by viewers. But i played really hard like all did, then i dont even have what i deserved, shiny rate is so so bad! And ofc, raiding, after 200 raids for each legendary pokemon, i still dont even know what shundo is? 9 years of playing, no shundo for me???? What? Why do i have to play still????",1,0.389.2,Ptn2611a,negative
35,2025-12-09T08:01:50-07:00,what a dragged animation just keep again n again and updates are ruining this game plz make this game concisely n speedy,2,0.389.2,awkwardream,negative
36,2025-12-09T06:17:17-07:00,"I love this game, really fun and exciting. Problems though are the insanely glitchy accounts, as I have repeatedly been locked out of my account. Niantic is also really cheap, and only cares for profit.",1,0.389.2,OrangeShrimps,negative
37,2025-12-09T05:40:27-07:00,"Its fun for a while, but I think it would be better if people could see Pokemon they haven’t seen before, instead of just seeing the same Pokemon over and over again and to many glitches to, I honestly don’t like Pokemon Go as much anymore because of the Nintendo switch games but it is fine when your bored. I won’t complain about Go passes though because their so much fun. And I do enjoy the game itself but not the most fun game ever. Maybe more fun for kids than adults.",4,0.389.2,Thomas 34892,positive
38,2025-12-09T04:30:20-07:00,"I do enjoy playing this game but there's a lot of stuff I see that needs to be fixed. First off the 50 pokecoin limit, please raise that back to 100. Seeing my pokemon come back from surviving in the park for a whole 2 days for 50 coins is just dumb. There's also some bugs where you get a white screen when you tap on a pokemon. In pvp I had a 1 on 1 against a Charizard on the end, the game said weak connection then they pulled a dragon claw out after literally just sending out their Charizard cause they were able to farm me for energy while it said ""poor connection"" and I couldn't do anything. The pvp bugs are a must fix because they're so infuriating. Also another thing, please bring legendaries back in the research breakthroughs. Using pokemon as a money grab is insane, the remote raid pass changes killed off an active raiding community at my closest park, there are some people that can't even properly experience the game cause of their area and gutting remote raid passes into the floor just made the experience so much worse, especially with the introduction of XL candy and the consistent paywall put on the good events now. also to the idiot writing in all caps about how he can't hit ace rank genuinely a skill issue but gave me a good laugh",1,0.389.2,Ethan Sederap,negative
39,2025-12-08T17:00:36-07:00,I have been very mad that I cannot sign in no matter what I do it will not let me if someone could assist me that would be great,5,0.389.2,Valentina I love you,positive
40,2025-12-08T16:50:30-07:00,"I’m poor so Pokemon go is the only Pokemon game I can have, I’ve been obsessed with Pokemon my whole life and just want games to express that love. But this game seriously needs to add a joystick. I’m disabled and I can’t walk for long periods or long distances. And I live in a rural area where the closest things are atleast  a 30 min walk from where I live. If I had a joystick I’d be able to play the game way more. But I can’t and so despite having the game for years I’ve gotten barely any progress AT ALL and playing battles is littraly impossible to win because people in bigger city’s that aren’t disabled have such better pokemon then me. The game is unfair to people who live in small towns and to be people who are disabled like me. I do hope the creators of the game fix this so disabled people like me can play this game.",1,0.389.2,Jaxiebot,negative
41,2025-12-08T16:31:19-07:00,This has happened a few times. One of my friends added me and I accepted their friend request and they never appeared under my friends list but they said I showed under theirs. Now I just sent my sister a friend request and she accepted. When I got on the app it popped up at the top for a second saying she accepted my friend request but she’s not showing under my friend list when I checked and yet again I was told that she can see me under hers. I’m not understanding why this keeps happening to me.,3,0.389.2,megseggsbaconnn,neutral
42,2025-12-08T16:18:09-07:00,"Dear Epic AR, please Just Nit use ID’s like Roblox is.",1,0.389.2,≈• Lifsoni_Rosenz •≈,negative
43,2025-12-08T16:15:35-07:00,I been playing off and on since it came out.  I wish it had d more avatar options I would love to make my avatar look more like me… only issue,4,0.389.2,Rocky Swain,positive
44,2025-12-08T15:54:49-07:00,"I love this game it’s so fun it’s family friendly and fun to collect all the Pokémon.
I love screaming “ gotta catch em all” and I have proof I love Pokémon. Definitely recommend for family games",5,0.389.2,Yorichi xs,positive
45,2025-12-08T14:58:43-07:00,"So idk when they updated this but now it costs mega energy every time to mega evolve your Pokémon instead of costing the first time and being able to do it infinitely, and I was trying to get my diancies mega level up for the buffs, and now I’m out of mega energy for it and I’m never gonna be able to get more of it, same with my charizard and beedrill, please change this",3,0.389.2,Mega Energy,neutral
46,2025-12-08T13:45:58-07:00,Seriously C’mon I Got temporarily locked out of my account for no reason just because my IOS settings for Time & Date weren’t set to Set Automatically this game is good don’t get me wrong but Please fix this bug because it is extremely Aggravating if Any Developers Read This please for the Love Of God Fix Your Game I’m almost Level 26 so I’ve been playing a lot of Pokémon Go lately and I’ve been pretty Engrossed in It.,3,0.389.2,Bnz3227,neutral
47,2025-12-08T13:35:06-07:00,Idk what happened but in the last few days it takes 20 seconds to load any Pokémon on the map,3,0.389.2,:] :] :],neutral
48,2025-12-08T12:57:47-07:00,"I LOVE POKEMON GO! I have played since July of 2016 and have a lot to show for it. As someone who is diagnosed with ADHD, this game helps me focus on things and keeps me distracted from the chaos. I don’t know if it is just me, but a couple of the Pokemon I clicked on today made the game randomly crash. The gift opening also has a weird delay after getting every item from the gift which is unusual. If these bugs have been reported by multiple other trainers, then please try to resolve the issue.

Go catch ‘Em all!",5,0.389.2,Lettuce 23,positive
49,2025-12-08T11:04:02-07:00,It’s rigid. The battle match making isn’t random at all. Pokemon go is a good game in idea. But the greediness of the company kills it. Battle league is made of Great Ultra and Master. If you like Pokemon don’t power them up to max for Master league unless is Legendary. All other Pokemon are useless minus 2-3 but you’ll need to use both shields for one Mewtwo and then they have two more legendary after. Why not get legendary of your own? To get the chance you need raid passes which they give you one a day and you have to pay for the rest. Good luck getting anything good if you don’t have the funds to play. Not to mention you’ll need 4 or more to win the battle hope you don’t live in a small area cause then you HAVE to buy and be invite by a friends or a entire different 3rd party app to play. The in game currency is won through gums. 50 coins max a day no matter is you have 20 guns cause they want you to spend real more to buy the fake money to play the game. It’s not a free game unless you live in a large area and are okay with not actually playing 50% of the game. While you can’t reach out to the support team they aren’t helpful at all. Just give you a link to the website mostly.,1,0.389.2,PokemonHatesYou,negative
50,2025-12-08T09:55:37-07:00,"Ever since Generation 4 (2007), Pokémon has gone downhill.
What used to be strategy, dedication, and actual gameplay has turned into a pay-to-win circus with microtransactions and lazy design.

As someone who grew up loving this franchise, I genuinely feel scammed.
These games don’t feel like Pokémon anymore — they feel like a nostalgia-bait scam made to drain your wallet.

Every year they promise improvements, but we just get the same empty formula, cut content, DLCs, and monetization everywhere.

I’m extremely disappointed.",1,0.389.2,OfficialSenpai,negative
51,2025-12-08T09:10:00-07:00,I’ve been playing this game on and off heavily since 2018 and I have to say that we could really use some sort of pity system. I try to only worry about getting the shiny forms for the strongest Pokemon in the meta mostly and I often find myself going way over odds for them. Kyurem is a 1/20 chance of being shiny but here I am 60 remote raids deep over the course of a week at $1.50 a pop and tax. It was a similar story for Zacian who I gave up on.,2,0.389.2,Pokemonfella,negative
52,2025-12-08T03:04:17-07:00,It was fun but when it wouldn’t let me play I deleted the all then downloaded it but now I can’t log in or make a new account so far but I’m trying to get a account for the game,4,0.389.2,Joey Wooten,positive
53,2025-12-07T20:46:45-07:00,"I played this game daily when it came out for years, after while the game just became repetitive and more features had to be purchased. I took a few year break. Came back recently and am SO disappointed. Spent money, played the game the way it was intended, and reaped little to no benefits. Wish I’d never given it a second chance.",1,0.389.2,AnneAlana,negative
54,2025-12-07T20:13:19-07:00,"Love this game, put many hours into it but it’s been crashing more often since it was bought out by a different group and now I’ve had it crashing often and lose Pokémon once and hour! Super annoying and makes me wanna quit the game tbh",2,0.389.2,Reviews4info,negative
55,2025-12-07T20:08:59-07:00,I cannot send gifts on my iPad version of this game and it needs looked into,2,0.389.2,Tenxeconds,negative
56,2025-12-07T19:58:31-07:00,"I have been playing this game on and off since the beginning and do enjoy it immensely, however I really wish you could make it so that when you log out of the game, it would remember that you turned off the AR buddy. That is rather annoying when you forget that you had logged out and you go to feed your buddy a treat and such, that it automatically goes into AR mode when you don’t want that option on. I play mostly at night and AR doesn’t work when it cannot see a flat surface. I really do not want to use it the majority of the time.",4,0.389.2,kim ley,positive
57,2025-12-07T17:01:34-07:00,"Game is nothing but glitches and bugs and lags, pvp is rigged to a 40-55% ratio, legendaries from raids are 90% of the time 2 stars, all of my mythical pokemon are 2 stars, constantly losing pokemon from raids because they are too hard to catch, this game sucks further and further with each passing week",1,0.389.2,samkj-h,negative
58,2025-12-07T15:12:04-07:00,"This game is really good but I recently found a weird glitch. There was a wild Flabebé on the map but all the sudden I heard a ""dun dun dun dun!"" sound (like the Zorua sound) and it turned into an Eevee! It was'nt a Zorua because Eevee was not my buddy either. After that, there was was a second Eevee next to it but it was a shiny. I'm not quite sure if that has anything to do with it. Devs please exsplain what's going on!!",4,0.389.2,Nik1524furn,positive
59,2025-12-07T15:09:30-07:00,Hello I’m Kenlee I love your game k bye,5,0.389.2,gtere22,positive
60,2025-12-07T14:43:27-07:00,Cant spin pokestops,1,0.389.2,louigotti,negative
61,2025-12-07T14:21:13-07:00,I’ve been playing this game for years and over the last six months this game cannot stop. I’ve submitted numerous reports to Niantic. I followed the instructions for how to avoid it and nothing helps. I can’t imagine that this is not an iOS problem.,1,0.389.2,Chicananerd,negative
62,2025-12-07T14:12:54-07:00,"It’s been about a week or two and the game has been very laggy. I’ve tried everything from deleting the app, restarting my phone, etc. nothing is working",1,0.389.2,Jason Skky,negative
63,2025-12-07T13:40:14-07:00,For the next update can you allow to trade Alr traded Pokémon please.,4,0.389.2,byghggbg,positive
64,2025-12-07T13:16:41-07:00,"Right now I’m very low on potion like about 1 super potion, you guys should make Pokémon centers to heal your Pokémon without ever needing one.",4,0.389.2,PartyCat13,positive
65,2025-12-07T11:35:00-07:00,"I walked like 5 km trying to look for even one shiny and I didn’t find a single one! Also, the quality of the Internet is absolutely abysmal. I’m never playing again.",1,0.389.2,U-10 and rebound are the best,negative
66,2025-12-07T11:32:33-07:00,Title says it all. They don’t care about their players.,1,0.389.2,SteveHeir93,negative
67,2025-12-07T11:18:20-07:00,My account froze but the battle continued so I could not fight back and was just paused while the won the battle but all else is good,4,0.389.2,You are stupid 2.0,positive
68,2025-12-07T11:05:40-07:00,"I haven’t tried it yet, but I suspect it will be a good choice. It is cold out and l’m grounded from YouTube and other video games so I asked my mom if I was at least ungrounded from this for exercise and she said sure. I suspect there will be bugs but I do not care just as long as it’s not just fun but also quality graphics. Unlike other peoples (peoples sound better in my opinion), I only complain at scam games and this would be fun. I’ve tried it, just not in this phone I’m on. I would definitely recommend this game even though I haven’t played it on this phone yet. The best parts would be the Pokémon battles though. Another part I loved were the boss Pokémon. Everyone gets a great day!",5,0.389.2,I love this cuz yeah,positive
69,2025-12-07T09:46:55-07:00,"Tons of lag, takes forever to load any screens, the animations are horrible.  Huge room for improvement here.",1,0.389.2,Rokodor,negative
70,2025-12-07T07:23:22-07:00,"I cant believe in 2025 this app still crashes randomly, just had my 5th winstreak in MASTER League crash at start and give the pay2win opponent a free win for no reason. Extremely infuriating and such a poorly optimized app shouldn't exist when they've had so many years to fine tune it. 0 stars.",1,0.389.2,00eeeee58,negative
71,2025-12-07T05:55:42-07:00,"Fix the raid system, whenever I have full network and do a remote raid, when the lobby is ready and the logo of the raid spins to enter the battle it does not load, and when I reload the app it keeps me in a loop infinitely and says the battle is completed but I get reloaded back in the lobby and when I click rejoin the battle, it repeats. And then my pass is wasted.",4,0.389.2,Little wolfi,positive
72,2025-12-07T05:28:56-07:00,I love the game but it keeps timing out since the last update.,2,0.389.2,Briteyes 1980,negative
73,2025-12-07T00:19:00-07:00,"The most recent update is unplayable, everything is running slow and freezing. Too many bugs to keep track of, and if that doesn’t keep you away from the game, everything is also so expensive, is hard to do anything without paying, or grinding for poke coins and it’s gone in a flash. On top of that you don’t listen to the community",1,0.389.2,Joelamiranda,negative
74,2025-12-06T17:49:37-07:00,"PvP needs work very well, when filled up attacks they don’t work when pressed at the right time. It lags giving the other players the advantage two or three moves. So many times does it freeze requiring me to leave in the middle of the game game and restart this week I noticed that the matches aren’t random as I think should be because when on a wining streak I notice they get harder and harder and when on a losing streak they get kinda easy to where they match you with some players that have pokemon with 10 hp and they are easy wins it’s not random players it’s more to where one side gets the advantage depending on their streak I guess.",2,0.389.2,Creator1918,negative
75,2025-12-06T15:53:54-07:00,I hate writing bad reviews and l love the game but I can’t get in using niantic kids and that’s all I have to say.,2,0.389.2,✨Sunny🤩,negative
76,2025-12-06T14:55:17-07:00,Pokamon go is the best game in the world!,5,0.389.2,Trading with my uncle,positive
