Unnamed: 0,updated,content,rating,version,author,sentiment
77,2025-12-06T13:38:19-07:00,For the love of Pikachu Please remove the 5 second blank screen after opening a gift.!!!  It take so long already to open a gift and now this extra time to open gifts is annoying !!!,1,0.389.2,Eggs 23,negative
78,2025-12-06T12:37:23-07:00,Pull a flipping logon Paul if you know you know,1,0.389.2,Tjpad9,negative
79,2025-12-06T11:10:20-07:00,"I love this game. I used to play it as a teenager, and it was awesome. I miss those times, and I really wish more people would download it and play daily.",5,0.389.2,Marco_PoloFN on YT,positive
80,2025-12-06T09:03:18-07:00,There a lag when you get to certain parts of the menu for friends,4,0.389.2,bobby23!,positive
81,2025-12-06T07:55:20-07:00,I have ADHD so sometimes it’s hard to stay entertained for a long period of time but this game does a great job keeping me entertained it’s a great way to get yourself moving I highly recommend getting this game,5,0.389.2,Aud24!,positive
82,2025-12-06T07:54:40-07:00,so sick of getting penalized by the rage quit “bug” in pvp. how hard is it to fix this? constantly getting the same spinning disc and “weak connection” (with good wifi and 5g) this game is unplayable garbage,1,0.389.2,dr thhgghufdckkufdru,negative
83,2025-12-06T07:30:18-07:00,The process of setting this app up is a waste of time.  20 minutes then they ask for SSN or card number to verify age.  I deleted this asap!,1,0.389.2,Milkerjhffeeeded5,negative
84,2025-12-06T06:31:32-07:00,"Unable to complete the go pass tasks because it was ‘fixed’ and refunds have been sent. This happed Thursday and even though progress is shown no rewards are given. Any attempts to re purchase the pas are unsuccessful and trying to use in game help just leads to a bot that is no help. On top of this game will crash at random times usaly when starting a raid, starting a grunt battle or scanning a pokestop. I understand bugs happen but some communication of issues and attempts to fix would be nice.",1,0.389.2,SailorShipper,negative
85,2025-12-05T18:51:59-07:00,"This personal enjoyment is a grand wonder to own. Personally, I would recommend it’s prestigious ways of soothing the difficultly of boredom, or having no knowledge of what you are to do. Again, this personal enjoyment is indeed worth the time you might spend on it. 
Post Script: Bruh dis game be highkey fire all up in the rizz world u better be gotten the broseff app or u be losin ur rizz or huz",5,0.389.2,Very prestigious,positive
86,2025-12-05T18:42:09-07:00,I’ve been playing this game for a year and it’s still not boring with the main Pokemon changing once every little while,5,0.389.2,mr latias,positive
87,2025-12-05T16:56:12-07:00,"the game is very glitchy and has no smooth play. The developers should fix the game vs updating the app with new useless features if this continues. Terrible way to monitor the game guys!!!

And yes, PVP IS STILL BROKEN!!’ TERRIBLE ALGORITHM!!!",1,0.389.2,Firemessenger,negative
88,2025-12-05T16:35:20-07:00,I played it for a while then it got boring and it was just sitting I. My apps,3,0.389.2,If was fine,neutral
89,2025-12-05T14:11:40-07:00,I play a lot I have a recommendation to let you take out chancy egg and for it to be a lucky egg and plz add a speacil reasearch where you can complete the choose 200 mega candys to give a Pokémon bty it should be called mega Monday,5,0.389.2,Sdeeffdf$=$&4&frft,positive
90,2025-12-05T12:43:21-07:00,Won a master all and suddenly goes missing. Pokymon caught go missing. Pokymon with 100 go missing. What janky progrming,2,0.389.2,T. Jinkinz,negative
91,2025-12-05T12:18:03-07:00,I used a lucky egg and started evolving Pokemons. After 20 mins I noticed noXP earned whatsoever. Ew bug after the latest release,3,0.389.2,sfghhbbdsruk,neutral
92,2025-12-05T08:51:28-07:00,"This update is bad, it causes a lot of freezing in app and sometimes makes certain sections freeze the game when accessing those sections.",3,0.389.2,Pedro116,neutral
93,2025-12-05T07:45:42-07:00,"This app is starting to make me mad. Not only are the cost of items high, half the time, the app doesn’t work. Pokémon don’t spawn, all the buttons to filter out Pokemon don’t work. When you want to see more filters and then want to see less, the ‘see less’ button doesn’t work so you have to close it all the way or restart the app, which turn it just keeps happening. 
Now to pin and unpin a gift doesn’t work right. You can pin a gift but can’t unpin it like before. 
The game is sluggish and I get lots of buffering circles(or whatever they are called) and sections of the app don’t work, Like viewing friends, viewing Pokemon, going into the shop! 
This app needs a much better upgrade and lower cost of items and boxes to make it more affordable to  the Community!!",3,0.389.2,Princesanikita,neutral
94,2025-12-05T07:35:57-07:00,It's super slow to open friend list in this version,3,0.389.2,Loud did,neutral
95,2025-12-05T05:30:41-07:00,You expect me to get a master ball to catch a shiny moltress that’s to long and to mean it’s like you are teasing people and yea I quit this game is just making me more sad every time I play. 😤,1,0.389.2,Air line fan,negative
96,2025-12-05T03:54:08-07:00,This app updates more than an “influencer” on twitter 🙄,1,0.389.2,Ninja skillzz,negative
97,2025-12-04T17:49:32-07:00,The kids is now on an adventure with his friend,5,0.389.2,Pokémon com,positive
98,2025-12-04T17:28:02-07:00,I have been playing this game for years and it’s so fun and it has helped me exercise so yeah I like it and you might like it to very fun.,5,0.389.2,The go fan,positive
99,2025-12-04T16:44:31-07:00,The movement has to be outside like kilometers or miles for best experience,5,0.389.2,Drcappybara,positive
100,2025-12-04T16:33:37-07:00,The new XP increase  animations that take up the entire screen are so annoying. Please remove them.,1,0.389.2,tacoburritofries,negative
101,2025-12-04T16:21:56-07:00,"Took me over 10 tries to catch a tepig😭✌🏼. Lost most of my berries and pokeballs, game is crazy bad.",1,0.389.2,hdhcjbdjxjdh,negative
102,2025-12-04T15:56:15-07:00,Been playing the last few weeks heavily again and had taken over a handful of gyms. Kept healing my mons and the others mons to full health when people attacked the gym. Held them for about 3 weeks. Pokémon go Removed all the gyms and sent our Pokemon back. We did not get any rewards and the hundreds of berries and dozens of Gold Razz’s from everybody was wasted. I’m not wasting my time with this app if you no longer get rewards for holding gyms.,1,0.389.2,Dezrakaz,negative
103,2025-12-04T15:39:50-07:00,Last update made it to where the app won’t fully load.  To report a bug you open and and report in app?   Apple user.    Help please.   I love this game,5,0.389.2,Help me please please!$!,positive
104,2025-12-04T15:15:01-07:00,"For the last month, the app keeps saying that it’s lost GPS. Yet in our house hold this is happening on both older devices and newer ones. Yet these devices have no other GPS issues in other apps. If you force quit the app, it comes back fine. Sound like the app thinks it’s loosing GPS and then can’t figure out how to recover.",2,0.389.2,WmH2,negative
105,2025-12-04T13:46:16-07:00,"No way I get a complete white screen, I go to close it app so I can go back in just so it won’t load me back in the raid that’s garage also wasn’t a raid pass for that to happen",2,0.389.2,KUSIDREAM,negative
106,2025-12-04T12:55:53-07:00,"Thank you so much for creating this app it reduced my passion for Pokémon my favorite part is that you exercise and play a amazing game at the same time 
P.s great job with max battles and seasons",5,0.389.2,Poipole67,positive
107,2025-12-04T11:37:16-07:00,This game is so addictive and fun and it got me and my dad out the house together before he sadly went to jail and he will be thare for a few years but I play this game all day every day,5,0.389.2,Camerin Sinclair,positive
108,2025-12-04T10:48:21-07:00,Love the game but since update never can seem to find my location bit annoying,3,0.389.2,brittneylynnxo,neutral
109,2025-12-04T09:31:51-07:00,возвращайтесь в россию,1,0.389.2,Лхххххз,negative
110,2025-12-04T07:18:39-07:00,This game is really fun it is a great for playing and walking the same time.,5,0.389.2,Good app for books,positive
111,2025-12-04T06:55:57-07:00,Great game!!,5,0.389.2,McMolly92,positive
112,2025-12-04T05:57:06-07:00,Every time I open the friends tab after the new season update it won’t load for 2 minutes. Fix that then it’s all good,4,0.389.2,ScrunchEv,positive
113,2025-12-04T05:40:30-07:00,I love this app! I love my shiny floragato so much!!!! But there was a glitch with my togepi in my……….,5,0.389.2,Rory J$,positive
114,2025-12-04T05:06:28-07:00,The game is fun but I suggest setting a limit for yourself as it can get addictive.,5,0.389.2,Shadow_Litten726,positive
115,2025-12-04T02:22:53-07:00,"Lags when opening gifts
Sticker list does not update",2,0.389.2,MegR,negative
116,2025-12-04T02:14:28-07:00,Won’t let me update with out credit card info,1,0.389.2,Wonderwoman-x,negative
117,2025-12-03T22:30:17-07:00,And strong spheres,5,0.389.2,kalyy1100,positive
118,2025-12-03T22:14:34-07:00,"Pokémon Go has been awesome it keeps my whole family happy playing events, community days, max battle weekend’s, max weekends. ( etc ) Since I had it I have been addicted to my screen getting shiny’s and powering up level. Pokémon Go is so fun",5,0.389.2,Mirai 95,positive
119,2025-12-03T21:48:01-07:00,"I just usually play Roblox, but this is my only thing to go outside and touch grass",4,0.389.2,Name: Gavin,positive
120,2025-12-03T21:30:04-07:00,"I play this with friends, family, coworkers, total strangers. This game brings people together. I love to play with my husband and 4 year old.",5,0.389.2,RahkelRampaged,positive
121,2025-12-03T21:23:56-07:00,I have one big question.why no Morison and mirador along with the paradox Pokemon like it’s a fun game but why just why no mirador and koridon,4,0.389.2,Glizzygobilin,positive
122,2025-12-03T20:29:57-07:00,The game is really fun and stuff but the memories that come with it our so much funner. My whole family plays and at first I was like “this is a nerdy game I don’t want to get it!” But my grandma convinced me and I have had a blast! I’m now like emotionally attached to this game because of the memories I can share with my grandma. 💕 thanks so much Pokemon go!!! Love youuuuuu!!!😍,5,0.389.2,Nfjcjfbonf,positive
123,2025-12-03T19:56:01-07:00,u should play it,5,0.389.2,………………………..….…,positive
124,2025-12-03T19:50:10-07:00,I like the game a lot of Pokémon to catch but what I don’t like about it is the graphics. They should make it a little bit more realistic.,5,0.389.2,Ben kulczyski,positive
125,2025-12-03T19:48:58-07:00,"Maybe add the new Pokémon from the Pokémon, legends  za game to the Pokémon go game for the next update that way if you’ve already caught the Pokémon, all you have to do is collect the mega stones for the Pokémon",5,0.389.2,Eighth baron emperor,positive
126,2025-12-03T19:23:30-07:00,This game is so good makes me so calm and happy Pokémon thank you u guys are awsome,5,0.389.2,Bronxeey,positive
127,2025-12-03T18:54:49-07:00,After updating app today. There is a long lag after opening a gift from a friend. It lags after cycling through the items when it should be returning to the friend’s page. Really annoying.,2,0.389.2,RoseyPoncho,negative
128,2025-12-03T18:16:24-07:00,i love this game i’ve been playing on and off since it first came out years ago but i barely recently started spending money on the game this year. and i am BEGGING pls let us gift the go pass. we can gift everything else but that. please add the option to gift the go pass and anything else that is able to be bought🙏🙏😓.,5,0.389.2,indi🎀,positive
129,2025-12-03T17:56:09-07:00,Just a underwhelming game attached to a popular IP.,1,0.389.2,Herri2ad,negative
130,2025-12-03T17:53:16-07:00,Can you please add the new Megas from legends ZA🙏,5,0.389.2,drheath227,positive
131,2025-12-03T17:40:32-07:00,Very fun and cool that it track your motion  but please make the raids harder their to easy,5,0.389.2,Bla bla guy,positive
132,2025-12-03T17:39:19-07:00,"I’ve played a lot of this game. I really like it. But frankly. Their pay to play strategy is the most predatory I’ve seen. This is the most expensive mobile game I’ve ever seen. 

However, you can have some fun for free. But you’ll have to GRIND",5,0.389.2,Niantic on their BS,positive
133,2025-12-03T17:24:41-07:00,"Pokémon Go is a super fun game but, there isn’t a lot of people who play where I live so it’s kinda hard to get poke coins cause no one knocks them out of the gyms. This is kinda annoying cause I can’t get remote raid passes cause there so expensive and I never get them anywhere else.",5,0.389.2,elmo is awsome,positive
134,2025-12-03T17:12:38-07:00,This game is one of the greatest mobile games I have ever played it has an amazing player base and the people are fun,5,0.389.2,hfhsjsj jj,positive
135,2025-12-03T17:06:43-07:00,"The Latest news, People are using modified & illegal Pokémon.",1,0.389.2,Jezzy M.D.,negative
136,2025-12-03T16:58:22-07:00,"I like it but it kicks me out of remote raids and I never get to catch the pokemon, so that is disappointing!",3,0.389.2,EllaCauser,neutral
137,2025-12-03T16:53:25-07:00,Five stars,5,0.389.2,Kdnclewnih4Cnre,positive
138,2025-12-03T16:34:36-07:00,The thing is it’s just having a few like too many updates. It had to end the past week practically or maybe I’m just not opening it that much having a few updates but also very good game so the gameplay is pretty good. The event was amazing level 27 great game,5,0.389.2,Easy. #Easton.,positive
139,2025-12-03T16:17:22-07:00,I love how others could help this is bc of teamwork friendship,5,0.389.2,sxjxmxbzh,positive
140,2025-12-03T16:06:08-07:00,Best game ever I love the creators,5,0.389.2,Colt3816,positive
141,2025-12-03T16:00:42-07:00,The games perfect I just wish i could give my excess items filling up my bag to other trainers. I have 300 pokeballs and 565 greatballs filling up my bag that i wish i could give to other people.,4,0.389.2,Davin Sequeira,positive
142,2025-12-03T16:00:23-07:00,Really fun and it got me back into Pokémon,5,0.389.2,kl82828282,positive
143,2025-12-03T15:53:48-07:00,I Can Catch Pokémon Anywhere And Spin Pokéstops! Also You Are Moving And Easy To Change User Name!,5,0.389.2,Cot Master 3,positive
144,2025-12-03T15:40:37-07:00,"This game has always had a problem with nickel and dining their players and it’s worse than it’s ever been. Multiple paid passes with terrible rewards, remote raids cost 2x and no guarantee you can even catch the pokemon. Events are just recycled, can’t remember the last quality of life update, now all we get is updates on ways to spend more money.",1,0.389.2,Posivated,negative
145,2025-12-03T15:10:58-07:00,I have been playing this game for years and it’s amazing! I play with my family and friends and we all have a good time together. I highly rate this game and think it is super fun for family!,5,0.389.2,Marco LaBa,positive
146,2025-12-03T14:59:39-07:00,정말 재밌네요. 각종 버그 빼면 완벽합니다,5,0.389.2,껍질몬 가장 좋아하는 사람,positive
147,2025-12-03T14:22:46-07:00,I love Pokemon Go! But I can't trade pokemon with my partner because it says they're at a gym. I can assure you my newly hatched pokemon have not been at a gym. Please look into this!,3,0.389.2,Abi_gailA,neutral
148,2025-12-03T14:17:48-07:00,I love it but Pokémon never spawn,5,0.389.2,Duck358,positive
149,2025-12-03T14:17:19-07:00,Nice,5,0.389.2,Moth_enthusiast,positive
150,2025-12-03T14:14:18-07:00,With an update every other day you barely even get to play the game,1,0.389.2,Bahaishxanapas,negative
151,2025-12-03T14:08:00-07:00,Game is good overall but we need game chat so we can talk to friends in the game to communicate with one another.,4,0.389.2,Wack25,positive
152,2025-12-03T14:03:04-07:00,I really love ❤️ this game but I don’t really like the way we need to pay for stuff cause a lot much stuff I would buy but I would rather something in the game you spend and it’s hard to get,4,0.389.2,Funnycatparty😹,positive
153,2025-12-03T13:46:58-07:00,OK game. Poor optimization. Game runs sluggish and crashes often on older devices.,1,0.389.2,cdxx,negative
154,2025-12-03T13:44:09-07:00,"I’ve never written a review for anything in my life but I truly love this game, my bf and I are both obsessed and go on “Pokémon dates.” Highly recommend",5,0.389.2,tammy thunndermaker,positive
155,2025-12-03T13:40:34-07:00,Awesome Game! 10/10,5,0.389.2,Grimo.22,positive
156,2025-12-03T13:34:45-07:00,"Lemon.



(This game has no ads btw)

This game is really amazing if you’re the type of person who plays long games for the grind. This game is really well made (except for a few little glitches, nothing game breaking.) This game takes very, very, VERY long to “complete” and I heavily recommend you download and play if you are up for the grind of Pokémon GO!",5,0.389.2,Lemon_Man333,positive
157,2025-12-03T13:21:22-07:00,"The games definitely fun no question but I’ve been playing for many years not as much as I use to maybe 1-2 times a week for around 15-20 minutes it’s just not as fun as it use to be I completely understand the developers need to make money to keep the game running smoothly but it seems any new fun parts of the game cost money and it’s not just a one time purchase you have to keep purchasing it. Many of the task require hatching of eggs and raids and no matter what you need a pass or incubators which aren’t free so unfortunately them tasks will not get finished unless you spend. Again, I completely understand developers need to make money to keep the game running, but it definitely shouldn’t be advertised as a free game. Because any part of it that is fun definitely is not free.",3,0.389.2,😂FREE GAME MY A*S !!!!!!!,neutral
158,2025-12-03T13:19:40-07:00,best game ever,5,0.389.2,This game is a bit creepy.,positive
159,2025-12-03T13:12:30-07:00,"I’ve been a player since PG launched in the summer of 2016.  A lot has changed to say the least.  Paid events used to be scarce with all events, research tasks, and bonuses FTP.  Now you can still be a FTP player but ALL events have a ticket that can range between $7-15 with many premium Pokémon and rewards being paywalled.  It’s still a fun game but you can’t truly play to the max now without spending a ton of cash.",1,0.389.2,CaptainAloha2016,negative
160,2025-12-03T13:09:29-07:00,I started this game a year ago then I deleted it and my account and I heard my brother and dad got into this game and I came back and I would most definitely recommend this game bc of its wonderful events and features. Thanks for reading bye,5,0.389.2,Getwrecked2ez,positive
161,2025-12-03T13:06:52-07:00,I’m in love with it,5,0.389.2,MDAlvarado,positive
162,2025-12-03T12:48:24-07:00,This is one of the funniest mobile I played in while but the only problem with this game is the raids.The roads are way too hard and the Niantic should make the raids easier like one all hard raids are like 5000 CP,5,0.389.2,CosmoTheGoat,positive
163,2025-12-03T10:23:11-07:00,Just how it used to be and funny idea every month one day randomly make it so that the first Pokemon they click on turns into a shiny legendary and when they catch it it turns into a ditto,5,0.389.2,I want one to be added,positive
164,2025-12-03T08:58:28-07:00,"Hi, Pokémon people! Love this game so much! Absolutely no regrets about adding it! Thanks for the incredible game! BTW, completely unrelated, but I want all of the Hazbin Hotel fans out there to remember; TRUST US WITH YOUR EVERYTHING. 
-Vox Populi",5,0.389.2,The Vox omega,positive
165,2025-12-03T08:27:00-07:00,"Been playing off and on since launch. Different devices, ios, android… 
Biggest gripe is the “this Pokémon is in a gym” issue that has recently became more of a problem.  At times my family will ask me to get on and help with a fight, trade a few monsters, assist in a party quest or two.
  This is hindered when I can’t trade my Pokémon for some reason and the only clue is its at a gym… but it isn’t at a gym, its a Pokémon i got exclusively to trade.  Is it graphical? Is there another reason?  Not enough resources? Too much of a level gap? A unique Pokémon? Because its 100% not in a gym. It’s not left at a poke stop.  

If it’s a bug, acknowledge it.  If its another reason, describe it accurately. 

This is the sole reason to not rate higher.   1⭐️ until its addressed.  Then i would gladly update my review based on the proposed and implemented solution.",2,0.389.2,Wtf.bob,negative
166,2025-12-03T05:41:59-07:00,"I’ve played the game off and on since it first came out, but over the last year I’ve been full steam on raid nights and weekends! I’ve enjoyed the weekly content and release of Pokemon that have been vaulted away for a while now! 10/10 would recommend especially if you are a walker keeps you well engaged!",5,0.389.2,Zaltock,positive
167,2025-12-03T04:25:40-07:00,"I’ve submitted a bug report, but this is so annoying. That little spinning wheel in the upper left corner of my game is just constant when I’m trying to check my friends list. I am on a strong Wi-Fi signal and if it’s not that I am on a strong cellular signal so I don’t know why this game is constantly doing this. And it’s not just confined to me. It happens to two family members as well. It’s frustrating trying to check my friends list for raids and I can’t see anything because of the spinning wheel.",1,0.389.2,_Lilith,negative
168,2025-12-03T04:07:51-07:00,I played for 2 years my brother introduced me to the game during a summer vacation and I was heavily addicted to this game then I got a new phone and I didn’t remember my password so I lost my account but this game will always stay in my memory,5,0.389.2,Team_anime21,positive
169,2025-12-03T01:39:23-07:00,"It’s been 7 Tuesday in a row where I I am left hanging and without a shiny Pokémon at their weekly Tuesday events. 7 WEEKS IN A ROW!

Always finish the 75 catch + much more yet no shiny. Always use the lure, lucky egg and stat and nothing. Whats the point of the event then?",1,0.389.2,MIS-guy,negative
170,2025-12-02T19:17:02-07:00,It is a very fun and active game. I recommend to people to try it. It is very fun and I like the quest.,4,0.389.2,C hug g g h f h,positive
171,2025-12-02T18:42:36-07:00,One of the best games I ever played,5,0.389.2,Yamal3,positive
172,2025-12-02T17:42:03-07:00,They took my account away and I’m really mad about it. It was a great game until they did it. I’m leaving a one star review because I can’t get it back because they deleted it. I’m deleting the app.,1,0.389.2,maxman027,negative
173,2025-12-02T16:25:45-07:00,"Sorry, it would be 5 star, but I can't sign in",1,0.389.2,Roblox review37,negative
174,2025-12-02T14:28:58-07:00,"I have been playing this game since 2016 and usually they fix the bugs really quickly however for the past two weeks I have not been able to access the game store they tell me that there is no timeline for this fix. Since this company was taken over by Scopely, I have never seen such a delay in fixing a problem. I don’t wanna go to a Web store when I need to get a pass or a ticket or anything else for an event I want to go straight from the app. Fix the problem. This is getting a one star and I will not change his review until you get it fixed.",1,0.389.2,Reneeregen,negative
175,2025-12-02T11:57:49-07:00,"The game is a lot of fun. But I got 2 main issues, I HATE when you’re riding as a passenger in a vehicle and you get a shiny because you have to use your master ball to get the shiny or it runs. Then when you live in a small town it’s almost impossible to get legendary or Megas.",4,0.389.2,Luckythelizard,positive
176,2025-12-02T11:50:38-07:00,"I love this game, but what we all need are different evolution items for Pokémon",5,0.389.2,FlipperJeans100,positive
177,2025-12-02T10:06:54-07:00,"This is a great mobile game I found it on an old phone and played it, it also performs well on my iPhone SE. and if ur like me you get addicted to this game and you hunt for those shinys get more then my 109 shinys",5,0.389.2,SprayNPray67,positive
178,2025-12-02T07:05:32-07:00,"Pokémon Go suffers from the same issue most mobile games do. It is “pay-to-win” only. I have played this game since it released and have enjoyed my time with it. But after many failed legendary raids I am deciding to put it down. It wouldn’t be so bad if you could use the great balls and ultra balls you have acquired. But for legendary raids you are expected to fail unless you have a master ball. You have a very limited number of premier
balls to use and even an excellent toss with a golden razz won’t be enough. I refuse to spend money on this game anymore because all it is, is a cash grab for the developer.",2,0.389.2,Darkfox90,negative
179,2025-12-02T05:57:18-07:00,I used to love this game. I’ve been playing since it came out but now that the support is all virtual with no humans it’s not helpful at all. I lost actual money because they would not replace my virtual pass even though it kicked me out before I even had a chance to catch my Pokémon.,4,0.389.2,Bernadette d,positive
