Unnamed: 0,updated,content,rating,version,author,sentiment
180,2025-12-02T05:37:32-07:00,"I’ve been playing pokemon go for years, however it has continually been glitching for months. I’ve checked updates, logged out and back in, deleted the app entirely and redownloaded it and it continues to glitch. It takes a ridiculously long time for everything to load once i start the app, probably a good 10-20+ seconds for power spots, pokestops and gyms, and pokemon to load after initially opening the app. i never had this issue in the past and have slowly lost interest in the game as every time i play it takes forever for anything to load.",3,0.389.2,(:$VV$:),neutral
181,2025-12-01T22:24:04-07:00,"To start, this game is full of bugs. Simplistic in nature and always connected via GPS is as complicated as this app’s architecture is going to ever be, yet it fails fairly often. 

Second, creating a Pokestop became irrelevant due to community contribution management. A Pokestop I attempt to create of a statue for a shopping center’s grand opening we’ll be denied, even after I’ve included the awesome speech from the ribbon cutting ceremony. A week later, a contribution will be accepted with a generic statement, “shopping center at so and so street.” (And a truly lackluster photograph, as well.) 

Worst of all, the community contribution team works AGAINST their slogan to “go outside and play” when I’ve contributed and been denied 4 out of 5 hiking landmarks. This is the most upsetting portion of the Pokémon Go system.

Fall 2025 update: bugs and glitches. Lots of them. From the constant gym under construction symbol flashing across your screen, to feeding your buddy issues, not the User Interface becoming dysfunctional with menu items that belong elsewhere. It’s horrendous and I’m concerned that they have allowed so many persistent problems to exist since the beginning of 2025.",3,0.389.2,Saemlinh,neutral
182,2025-12-01T19:36:12-07:00,When you send in problems you get a robot telling you ok. We may fix it next year. Lol. When ppl stalk you they don’t handle it.,1,0.389.2,Anomalous2,negative
183,2025-12-01T18:32:46-07:00,So I know this is a minor thing but with the latest version as you earn XP it shows a ye amount at the bottom where your name is. So you can’t see how much you’ve earned. I don’t like it,3,0.387.1,ptworkingmom,neutral
184,2025-12-01T16:39:25-07:00,The game is so fun and I love it because you can trade me and all my family and friends play,5,0.387.1,Isaiah the 67god,positive
185,2025-12-01T14:58:02-07:00,"I am a big Pokémon fan, but a few days ago, the game signed me out and now I can’t play. My parents have tried to help me get back in but whenever I put in my ID, it doesn’t work… 

I’m really disappointed in this, but I don’t know if I’m the first person to have this happen. I really hope that you guys fix it.",1,0.387.1,Bioggigle,negative
186,2025-12-01T14:42:35-07:00,"It keeps signing me out and the return button freezes and doesn't work! If this were fixed, it would have a 4",3,0.387.1,Fishessssilove,neutral
187,2025-12-01T10:33:31-07:00,"My review is still positive but I find a lot of the character and buddy system rather bland and disappointing. It’s been awhile since the game was released and since I’ve played. While they have made it easier to level up they still haven’t managed to improve aspects of the game which would be quality of life like a little more in depth buddy system, customize pokeballs etc. they really haven’t progressed much and really should for a more personalized trainer experience.",3,0.387.1,the finaly episode,neutral
188,2025-12-01T10:06:08-07:00,Can you explain the reasoning to me on why I would have 9 Great throw in a row on a raid I finished in one minute and didn’t get the Pokémon I can’t speak for everyone I love a challenge as much as anyone but I play this to catch Pokémon not be robbed of them,1,0.387.1,Perryboii233,negative
189,2025-12-01T01:08:25-07:00,have loved it but recently it has many inconvenient glitches 😭,3,0.387.1,Just my Opinion 🙃🤦🏻‍♀️,neutral
190,2025-11-30T20:18:02-07:00,The game is extremely fun but can you add a daily remote raid pass or lower down the price for the remote raid pass because it takes 4 days at best to get one because it costs 195 poke coins and some people are kinda restricted to the places to go because of the fact that they can’t drive let. So can you guys do something about it please I’ve been playing it since 2018 but I changed accounts🙏,5,0.387.1,Gamerguy66,positive
191,2025-11-30T18:34:18-07:00,You have glitches every 2 seconds and u make it ridiculously dumb to catch Galatian birds.,1,0.387.1,Nobodylolll17,negative
192,2025-11-30T18:06:04-07:00,I was about to buy it now it’s gone because of you guys make it be until the 5th of December,1,0.387.1,Karen Patel,negative
193,2025-11-30T17:36:51-07:00,My candy xl doesn’t work,3,0.387.1,Vonfrm410,neutral
194,2025-11-30T17:29:14-07:00,Hey I can’t power some of my pokemon with XL candy it could be nice if you could fix that and some stuff is going really slow so fix that too. Thank you reading this review,5,0.387.1,Gono King,positive
195,2025-11-30T17:22:26-07:00,"Custom names get stuck and don’t change w/ evolution, etc.",4,0.387.1,wadick4,positive
196,2025-11-30T16:17:41-07:00,stupid game,1,0.387.1,asdfghjjklge,negative
197,2025-11-30T16:09:33-07:00,I joined a Pokémon Go club at a school I don’t go to anymore. I still love the game.,5,0.387.1,FUNNY BUSINESS TODAY,positive
198,2025-11-30T16:05:15-07:00,"I’ve played Pokémon Go on and off since launch, and honestly? At this point it deserves one star — and that’s generous. Nearly every major complaint the community has raised over the last few years is still unresolved or has gotten worse.

1. Remote Raids Were Gutted
The remote raid nerfs were one of the biggest blows to the game. Costs went up, limits were added, and accessibility tanked. Players who can’t travel, rural communities, and anyone with a busy schedule all got punished. It felt like Niantic forgot the entire reason those raids existed: to let people actually play.

2. The “Exploration” Philosophy Hurts More Than It Helps
Niantic keeps forcing the “get outside and walk” angle by making features inconvenient unless you’re in a major city. The problem is: not everyone lives in a downtown full of PokéStops. Rural players still get barely any spawns, few gyms, and almost no new stops approved. The “exploration” lecture gets old when the in-game world barely exists outside urban hubs.

3. Event Fatigue & Low Quality Events
Events used to be exciting. Now they’re constant, repetitive, and full of recycled spawns, bad shiny rates, and FOMO. So many “paid” events deliver almost nothing of value. You finish one underwhelming event and immediately another one starts — usually requiring more money, more passes, and more walking for the same stale rewards.

4. Bugs… Bugs Everywhere
This game still crashes, freezes during raids, fails to register throws, loses GPS for no reason, and has lag spikes during literally every important moment. For a billion-dollar franchise, the technical quality shouldn’t feel like a beta test.

5. Too Much Monetization, Too Little Improvement
The shop is overflowing with overpriced boxes and paywalled features, but basic quality-of-life updates (increased storage, better sort/filter tools, better gym mechanics) are slow or nonexistent. It feels like Niantic is always ready to charge for something but rarely ready to fix anything.

6. Communication Is Terrible
Changes get rolled out without warning, player feedback is ignored, and when the community pushes back, the response is usually vague PR language. It gives the impression that Niantic doesn’t actually play its own game.",1,0.387.1,Norig Zenun,negative
199,2025-11-30T15:36:56-07:00,Oh my gosh my favorite game it so also me download now!,5,0.387.1,Evie The Tiger,positive
200,2025-11-30T14:35:15-07:00,"The things within the game like Lures, incense, or berries never work on my device (iphone11) hopefully they can fix that bug.",1,0.387.1,Lexlexlexlexlexlexlexlex,negative
201,2025-11-30T12:39:52-07:00,"This game was once a favorite of mine and I used to enjoy playing it religiously. Unfortunately it has become increasingly unpleasant to play.

Number one example: remote raids are a ripoff with the game crashing 10-25% of the time while raiding. Remote raid passes are expensive and when the pass is loss due to the game crashing, Niantic will not compensate players. After filing claims, users will receive an automated message claiming the user was already “rewarded” for the raid when in fact users did not have an opportunity to catch the raid boss. After restarting the game, there is no mechanism to return to a remote raid in order to complete it. As a result, users lose a remote raid pass. Niantic provides zero compensation for the lost pass, which many users paid for.

It is one thing if remote raids passes are free, but when users pay for these passes and the game crashes, it “steals” people’s money without compensation. That is not right!",1,0.387.1,***DC***,negative
202,2025-11-30T12:37:12-07:00,Pokemon says it’s assigned to a gym when it’s not. Can’t trade the Pokémon during the holiday. Totally ridiculous.,1,0.387.1,Gggggtgjvjlgkhcihf,negative
203,2025-11-30T12:34:19-07:00,"Terrible app performance, zero support from the devs, money black hole. Don’t. Just don’t.",1,0.387.1,aastafford,negative
204,2025-11-30T11:59:34-07:00,I have so much fun and just the best Pokémon mobile game ever,5,0.387.1,Noah gionne,positive
205,2025-11-30T11:39:52-07:00,"The game is fun but it constantly needs to be updated. Other than that, it’s a pretty good game.",4,0.387.1,A guy that wrote this review,positive
206,2025-11-30T10:40:57-07:00,"So many memories with this game. Thank you Niantic and the team over there for this game. GBL is a lot of fun, the events and com days. So many shiny and hundo pokemon. Most of all I will always love playing this game with King Jesus by my side!",5,0.387.1,c2a5g,positive
207,2025-11-30T09:29:37-07:00,Every thing good about it  even the glitch’s the brake though and the Pokèmon.,5,0.387.1,HyorinmaruNTK,positive
208,2025-11-30T08:47:50-07:00,"Your game is trash it’s clearly rigged against us if you get three excellent throws in a row, it should mean catch you money greedy junkies.. I hope y’all crumble soon",1,0.387.1,dunkendickyournuts,negative
209,2025-11-30T07:32:58-07:00,Very angrifieyeing game stupid booty cheeks very hard to catch,1,0.387.1,I love to eat sour jelly,negative
210,2025-11-30T04:24:17-07:00,"This game will eat movie right out of your pocket. Since being owned by a U.S company, the game has been non stop glitchy and have had numerous amounts of money in raids that the company REFUSES to refund or return when their game craps out. If you’re going to play, don’t spend your money.",2,0.387.1,AstroAJ26,negative
211,2025-11-30T00:51:59-07:00,I normally 100% love the game but over the last few days I’ve tried reaching out to customer support and all I get are automated bots that don’t help. I needed an issue resolved with a remote raid and a pokemon fleeing early when I still had balls left to catch. Issue was not resolved and I’m out a raid pass and a legendary pokemon.,4,0.387.1,manuelittooo,positive
212,2025-11-29T23:00:10-07:00,"Their customer service is a bot that doesn’t address anything you ask. Can’t talk to a person, completely useless",2,0.387.1,facepalmmmmm,negative
213,2025-11-29T20:49:45-07:00,So I’ve been playing this game for a couple of year and I love some of the updates but in thing that I don’t like is that you can’t change the height of your avatar.Every single time I go and change the clothes that I’m wearing I look goofy in them because I have a face of a baby and the height of a women.If only we could adjust our height I think it would match with appearance that we choose.,4,0.387.1,Kneecap117,positive
214,2025-11-29T19:05:40-07:00,"Besides price inflation on remote raid passes, my issue is how glitchy this game is. It crashes CONSTANTLY especially for remote raids but even GPS too. FIX IT!",3,0.387.1,collinse22,neutral
215,2025-11-29T18:35:52-07:00,I have played this game for a long time and it still isn’t boring they constantly update and do events I’ll play in the car (as a passenger),5,0.387.1,Jebk12,positive
216,2025-11-29T18:06:27-07:00,This game has been so much fun to play and enjoy with my friends while also doing the raids and hunting for my favorite Pokémon! Love this game and would 1000% recommend it to anyone who would want to play,5,0.387.1,Lolzfor the vibes 67,positive
217,2025-11-29T15:55:03-07:00,Diddy ahh,5,0.387.1,The first time ..yjk,positive
218,2025-11-29T15:47:22-07:00,Awesome game but has many glitches like with power spots and it may crash sadly. :(,2,0.387.1,Puldebdobe 981,negative
219,2025-11-29T15:24:24-07:00,I am an avid user and ever since I upgraded to the iPhone 17 max I have to click away most of the items that I receive after spinning a go spot. PLEASE FIX THIS IT IS SOOOOO ANNOYING,1,0.387.1,Sexielexie,negative
220,2025-11-29T15:15:21-07:00,The Best mobile game I have ever played and it helps me exercise and super easy to play,5,0.387.1,Hsbdhurbdh,positive
221,2025-11-29T12:42:35-07:00,All I wanted to have fun playing a nostalgic game with my family and Niatic decides to put out the lugia dynamax raids which infuriated everyone and caused huge arguments. One star is generous,1,0.387.1,Noah69696969,negative
222,2025-11-29T12:36:22-07:00,I threw out my arm catching a Pokémon and it only went 25% of the distance I needed,1,0.387.1,the game is terrible!!!!!!,negative
223,2025-11-29T12:32:49-07:00,"Over the years the mechanics and content in this game have gotten better and better. Very cool stuff added like battling team rocket, dynamax pokemon, etc. However certain pokemon such as some legendary shinies are now locked behind pay walls. I could understand a monthly subscription that enables all extra content, I might even pay like $20 a month for it. But individual event tickets are now in excess of $8 for a single day event. The greed is out of control.",3,0.387.1,ZaddyHanzo,neutral
224,2025-11-29T11:35:34-07:00,Kan jeg logge inn,5,0.387.1,Nola bæsje,positive
225,2025-11-29T10:43:37-07:00,"Solo gameplay is ok, but they hype up “events” featuring overpowered Pokemon only available for short periods of time and then make it impossible to coordinate with other trainers to actually catch the Pokemon. If you don’t have a dedicated group of IRL players to walk around with, the only way to catch high level Dynamax Pokemon is to stare at the nearby raid screen all day, hope that a number between 2-6 pops up under one of the raids, and then, if it does, try to join immediately and pray you make it in before the other trainers enter the raid. Most of the time, this method does not work, so you’re left starting at advertisements for Pokemon that are impossible to catch.",2,0.387.1,ALM76547,negative
226,2025-11-29T10:05:09-07:00,Spending all the money on remote raid passes since there are no gyms or dynamaxes where I live. Use all the high level berries and still don’t get the raid Pokemon. Has happened almost every time. Worst feature ever.,1,0.387.1,Lash40,negative
227,2025-11-29T09:25:03-07:00,Talking to my other and also my kids and they love it,5,0.387.1,First time I ever got scammed,positive
228,2025-11-29T08:23:24-07:00,How. Do. You. Sign. Up.,1,0.387.1,Sonic the Rater,negative
229,2025-11-29T08:22:20-07:00,"Dear Pokemon Go

Please consider adding a re-enter button to the Power Spot tab for trainers who used a remote raid pass to rejoin the lobby without needing to wait for another invite. This game is wonderful and a lot of fun to play everyday. 
However with the release of Dynamax Lugia, I lost 2 Remote Raid passes due to not being able to rejoin the lobbies because I can not do so unless I’m invited. I found this to be disappointing because I saved up for the Remote pass bundle but immediately lost 2 due to not being able to rejoin. The Pokemon GO game app is still wonderful, and innovations like a button to re-enter a Remote Raid/Remote Dynamax/Remote Gigantamax lobby would improve player satisfaction. As well as help them get the most out of their items they saved up to use when new Pokemon make their debut, such as a Dynamax Lugia. I hope this message finds you well. Happy holidays and thank you for you time. 

Kindly, 

•  Supreme115",4,0.387.1,Tomas_Izaguirre,positive
230,2025-11-29T08:02:33-07:00,I literally lost $20 and they refused to refund it. I never got my silver bottlecap and they wouldn’t give me one or refund the purchase. They also refused to refund my remote raid pass despite a bug making me lose it. I can’t support a game that is this greedy and isn’t willing to help the players at all.,1,0.387.1,Noah11677,negative
231,2025-11-29T07:42:55-07:00,I couldn’t catch the umbrella now. It was the last one I needed it. I need it give it to me or I’m not changing this review.,5,0.387.1,Thank you and I’m sorry,positive
232,2025-11-29T07:18:56-07:00,"The game is so slow you got your ultimate move and you press on it so many times, but it decides to let your opponent go first after hitting you once or twice while you’ve been pressing your ultimate button move 20 times per second which causes you to lose over and over and over. It’s not worth it anymore.",1,0.387.1,Alec9995,negative
233,2025-11-29T03:58:39-07:00,"Pokemon go is amazing it tote me haw to wock you can rimot trade pass to tricks you to be acktiv and I will teech you haw to wock frst you tack your large a tack a step you do that ripeetivly with both lages and I am    
12",5,0.387.1,XYZ33K,positive
234,2025-11-29T03:22:29-07:00,I don’t support these practices. They do everything possible to get you to spend money. Not worth it. Pokemon held gym for 4 days and only 50 coins. Semd my pokemon back if that is the case.,1,0.387.1,CjYoungAngel,negative
235,2025-11-28T18:48:29-07:00,I wish they had an event where Mewtwo’s clones show up and we have to capture them with pokeballs (clone balls) that you could get in the event maybe on poke stops or achieving in the event.,3,0.387.1,Nyenkitoy,neutral
236,2025-11-28T15:54:46-07:00,It’s too hard catching galar birds and the never spawn at least make a legendary community day so more people can have one,2,0.387.1,This 7263,negative
237,2025-11-28T13:40:30-07:00,"Overall, I’d like to say that this game is fantastic. However, there are a few flaws and such that don’t make it perfect. For example, sometimes the lack of things to do can lead to boredom. For new players, here is something to note; this game is not good to resort to when your stuck at home. It is an outdoor game and is best played when outside. Continue my review for more in-depth information and thoughts.

There should be some things added to Pokemon Go that would improve it. One of the things I would like the most is the addition of more things to do with your buddy Pokemon. For those who don’t know, your buddy Pokemon is a Pokemon that you choose to accompany you on your journey. Though you are able to pet, feed and take pictures with your buddy, it’s all kind of plain. Maybe instead of just petting your buddy to fill up the play hearts, you could actually play with your buddy! There could be toys to unlock, such as rubber bones, tennis balls, etc. With this addition, you could also increase that maximum play hearts from one to three. Another suggestion for the buddy Pokemon is to spruce up feeding them. You simply throw a berry of your choice at them and they eat. What if you could prepare the berries? If you prepared them well, it could make them travel longer with you! This next idea may have a couple flaws, but I also think the addition of beds and dens would be cool. Your buddy could sit in them and relax, though I don’t know if it would have much of a purpose. Moving away from buddy Pokemon, there are a few more things I would like to discuss. During COVID-19, there was a weekly box for 1 pokecoin. Though I see why the developers wouldn’t want to add it back due to such a low price, adding something similar would be great. For example, you could sell a few random rare items each week for 50 pokecoins. Though this could leave a dent in currency, it would benefit many players and more people would enjoy the game. I have one last suggestion I would like to make; camera mode. If you click on a Pokemon in the map, you can go into AR mode. But what if you could just look around with the camera and you could find hiding Pokemon? I can see this being fairly complicated, but it would be a game-changing addition and 5-star ratings would fly to the sky. 

There are multiple flaws throughout the game. But I have come up with some ideas to handle them. For one; raids. In quieter towns, you are likely to be the only person raiding, which can be a problem if your trying to take down an opponent with more than 8,000 CP. Considering that the most wanted opponents range between 40,000 - 50,000, this can be fairly hard for some people. To fix this, people in the area should get a notification that a person has joined a certain raid and that they are searching for members. It would look something like this:

“(Player) is looking for members to help defeat (Pokemon) at (Location)!”

I know that Niantic Campfire exists for this reason, but it would be easier if you could just get a notification. Another one of the flaws is actually Campfire itself. I understand that it’s easy for the developers since it supports all their games. But what about the player? Having the download another app makes no sense. Campfire should just be installed into their games. The app can also be dangerous. Announcing your location to anybody with the app is a huge issue. Imagine how many people that just downloaded the app to get someone’s location? 

But overall, if you’re thinking about getting this game, I say you should download it. It’ll give you a fun experience if you like to be active and you’ll definitely enjoy it. Just remember to safe and be aware that while this game is good it has its flaws!",5,0.387.1,Reviewer372728,positive
238,2025-11-28T13:28:10-07:00,I don’t think it’s fair if I’m hitting back to back excellent on a Pokemon just for it to pop out every time what more can I do need to be able to get the remote road pass back after that dude it’s a waste for something I can’t do anything more for,1,0.387.1,Deathstroke1126,negative
239,2025-11-28T11:56:26-07:00,I haven’t caught a single shiny Pokemon since Tuesday and lots of  Pokemon despawn or flee before I can encounter them,1,0.387.1,My Pokemon TCGP frustrations,negative
240,2025-11-28T11:33:37-07:00,Here we go again. $7.99 and up for the December 2025 Deluxe Pass and NO lucky trinket. Instead we get an extra incubator. Lame. Not worth the money. Stop playing around Scopely. Nobody wants an incubator for Christmas.,1,0.387.1,XxKittyLoafxX,negative
241,2025-11-28T10:06:28-07:00,"I did a run and adventure sync didn’t log it. After all the necessary troubleshooting steps, I talked to customer support and told them what I did to try and resolve it. They ended up giving me the same suggestions as the things I already tried…still waiting for the issue to be resolved and distance to accurately be logged. You’d think customer support would give more attention to those who actively spend on the game but I guess not. One star until I receive compensation for the time wasted…",1,0.387.1,QuikSilver24,negative
242,2025-11-28T09:58:04-07:00,Everything about it is good and it gets u to have a workout by going everywhere the only bad thing is when u run out of pokeballs,5,0.387.1,Shadowblaze3-6-9,positive
243,2025-11-28T09:57:47-07:00,"I’m really upset that I’ve wasted so many passes for Pokémon to not be caught. Even with excellent throws and silver and golden berries, pokemon are unable to be caught. Annoyed.",2,0.387.1,hotmess9,negative
244,2025-11-28T09:39:12-07:00,"I really love Pokémon Go. It’s so much better than any other app. It has no ads. ABSOLUTELY no ads! I caught lots of Pokémon, but one day I clicked the button “sign out” and I couldn’t get out of it! It took me months and months to sign back in. After, I finally signed in, but I restarted it! I really missed my Florgato and my Sprigatito. But u should definitely download it. ALERT! Do not press sign out please! Thanks for reading this passage!",4,0.387.1,Sabrah17,positive
245,2025-11-28T09:18:01-07:00,"I have played this game for about a few weeks now after reinstalling, and I have got to say it’s wonderful; It’s addictive and fun. Alas, I do have a concern. My Tauros was defending a gym for about eight days, and came back with absolutely no poké-coins. Now, I’m not sure if this was a game error or a personal one, but it was very disappointing for my Pokemon to be there for such a long time only to come back with nothing. In all it’s a wonderful game: full of great Pokemon, exciting battles, amazing graphics and AR. Thank you for this game.",5,0.387.1,dragonskies🤩,positive
246,2025-11-28T06:40:53-07:00,"People say “don’t hate the player, hate the game” which I 100% do, but my god do people really have no type of life, with counting moves and playing a 10y/o game non stop. I came back to give it a try and boy do I regret it. Can’t play for fun anymore. PvP People playing like their life depends on it. Theres always a meta Pokémon people exploit",1,0.387.1,Gmonster11231,negative
